{
  "schema_version": 1,
  "upstream_commit": "5319368bae16500ca5267f6f8d68b36c9586d5bb",
  "blocking_statuses": [
    "UNMAPPED",
    "REVIEW_REQUIRED",
    "BLOCKED"
  ],
  "categories": {
    "packages": [
      {
        "pattern": "@aedifex/core",
        "status": "AUTHORITATIVE_KERNEL",
        "owner": "aedifex-building-kernel",
        "integration": "Vendored package; authoritative editable SceneSnapshot and Plugin API v2.",
        "rationale": "Required by the integrated editor and revision bridge."
      },
      {
        "pattern": "@aedifex/viewer",
        "status": "AUTHORITATIVE_KERNEL",
        "owner": "aedifex-building-kernel",
        "integration": "Vendored viewer embedded in the local floorplanner host.",
        "rationale": "Retains native rendering and selection semantics."
      },
      {
        "pattern": "@aedifex/editor",
        "status": "AUTHORITATIVE_KERNEL",
        "owner": "aedifex-building-kernel",
        "integration": "Vendored editor component mounted once by @arcz/aedifex-floorplanner.",
        "rationale": "Preserves the complete upstream authoring experience without duplicating editor state."
      },
      {
        "pattern": "@aedifex/nodes",
        "status": "AUTHORITATIVE_KERNEL",
        "owner": "aedifex-building-kernel",
        "integration": "builtinPlugin is loaded through Plugin API v2.",
        "rationale": "All admitted built-in node kinds remain native."
      },
      {
        "pattern": "@aedifex/mcp",
        "status": "LOCAL_TOOL_BRIDGE",
        "owner": "arcz-global-chat",
        "integration": "In-memory MCP server over a revision-isolated SceneBridge; mutations require revision match and approval.",
        "rationale": "Reuses upstream tools without network dependency or direct scene writes."
      },
      {
        "pattern": "@aedifex/plugin-trees",
        "status": "LOCAL_PLUGIN",
        "owner": "aedifex-building-kernel",
        "integration": "treesPlugin and treesHostPanel loaded locally through Plugin API v2.",
        "rationale": "Preserves the upstream community tree extension."
      },
      {
        "pattern": "@aedifex/ifc-converter",
        "status": "LOCAL_IMPORTER",
        "owner": "floorplanner-exchange",
        "integration": "IFC bytes convert locally to the native Aedifex scene graph with transactional persistence/rollback.",
        "rationale": "No external IFC service or format simulation."
      },
      {
        "pattern": "@repo/*",
        "status": "BUILD_ONLY",
        "owner": "toolchain",
        "integration": "Preserved only in the vendored workspace build; not an ARCZ runtime domain.",
        "rationale": "Monorepo configuration packages are required for reproducible compilation."
      },
      {
        "pattern": "*",
        "status": "REVIEW_REQUIRED",
        "owner": "architecture-review",
        "integration": "Classify package ownership and runtime exposure before updating the pin.",
        "rationale": "Unknown packages can introduce duplicate state, network calls or incompatible licenses."
      }
    ],
    "apps": [
      {
        "pattern": "*ifc*converter*",
        "status": "FOLDED_INTO_ARCZ_PANEL",
        "owner": "floorplanner-exchange",
        "integration": "The pure converter package is used inside one ARCZ Import/Export panel; the standalone demo app is not shipped.",
        "rationale": "Avoids duplicate IFC UIs while retaining converter capability."
      },
      {
        "pattern": "*editor*",
        "status": "REPLACED_BY_ARCZ_HOST",
        "owner": "floorplanner-shell",
        "integration": "Upstream demo/editor app is preserved as reference; @arcz/aedifex-floorplanner is the only shipped host.",
        "rationale": "One shell, one scene store, no competing project persistence."
      },
      {
        "pattern": "*",
        "status": "REVIEW_REQUIRED",
        "owner": "architecture-review",
        "integration": "Decide whether to fold, preserve as reference, or reject each additional upstream app.",
        "rationale": "Apps may contain providers, databases or duplicate UX."
      }
    ],
    "plugins": [
      {
        "pattern": "@aedifex/plugin-trees",
        "status": "LOCAL_PLUGIN",
        "owner": "aedifex-building-kernel",
        "integration": "Loaded with duplicate guard through loadPlugin().",
        "rationale": "Pinned and included in the UI."
      },
      {
        "pattern": "packages/plugin-trees/*",
        "status": "LOCAL_PLUGIN",
        "owner": "aedifex-building-kernel",
        "integration": "Owned by the admitted tree plugin.",
        "rationale": "Source-level declarations are covered by the package admission."
      },
      {
        "pattern": "*",
        "status": "REVIEW_REQUIRED",
        "owner": "plugin-admission",
        "integration": "Run compatibility, license, cleanup, deterministic serialization and offline tests.",
        "rationale": "Community plugins never auto-install merely because they are found."
      }
    ],
    "node_kinds": [
      {
        "pattern": "site",
        "status": "INTEGRATED_NODE_KIND",
        "owner": "aedifex-building-kernel",
        "integration": "@aedifex/nodes builtinPlugin loaded through Plugin API v2",
        "rationale": "The complete native node definition, renderer, tools and schema stay in the pinned authoring kernel."
      },
      {
        "pattern": "building",
        "status": "INTEGRATED_NODE_KIND",
        "owner": "aedifex-building-kernel",
        "integration": "@aedifex/nodes builtinPlugin loaded through Plugin API v2",
        "rationale": "The complete native node definition, renderer, tools and schema stay in the pinned authoring kernel."
      },
      {
        "pattern": "level",
        "status": "INTEGRATED_NODE_KIND",
        "owner": "aedifex-building-kernel",
        "integration": "@aedifex/nodes builtinPlugin loaded through Plugin API v2",
        "rationale": "The complete native node definition, renderer, tools and schema stay in the pinned authoring kernel."
      },
      {
        "pattern": "wall",
        "status": "INTEGRATED_NODE_KIND",
        "owner": "aedifex-building-kernel",
        "integration": "@aedifex/nodes builtinPlugin loaded through Plugin API v2",
        "rationale": "The complete native node definition, renderer, tools and schema stay in the pinned authoring kernel."
      },
      {
        "pattern": "fence",
        "status": "INTEGRATED_NODE_KIND",
        "owner": "aedifex-building-kernel",
        "integration": "@aedifex/nodes builtinPlugin loaded through Plugin API v2",
        "rationale": "The complete native node definition, renderer, tools and schema stay in the pinned authoring kernel."
      },
      {
        "pattern": "slab",
        "status": "INTEGRATED_NODE_KIND",
        "owner": "aedifex-building-kernel",
        "integration": "@aedifex/nodes builtinPlugin loaded through Plugin API v2",
        "rationale": "The complete native node definition, renderer, tools and schema stay in the pinned authoring kernel."
      },
      {
        "pattern": "ceiling",
        "status": "INTEGRATED_NODE_KIND",
        "owner": "aedifex-building-kernel",
        "integration": "@aedifex/nodes builtinPlugin loaded through Plugin API v2",
        "rationale": "The complete native node definition, renderer, tools and schema stay in the pinned authoring kernel."
      },
      {
        "pattern": "door",
        "status": "INTEGRATED_NODE_KIND",
        "owner": "aedifex-building-kernel",
        "integration": "@aedifex/nodes builtinPlugin loaded through Plugin API v2",
        "rationale": "The complete native node definition, renderer, tools and schema stay in the pinned authoring kernel."
      },
      {
        "pattern": "window",
        "status": "INTEGRATED_NODE_KIND",
        "owner": "aedifex-building-kernel",
        "integration": "@aedifex/nodes builtinPlugin loaded through Plugin API v2",
        "rationale": "The complete native node definition, renderer, tools and schema stay in the pinned authoring kernel."
      },
      {
        "pattern": "cabinet",
        "status": "INTEGRATED_NODE_KIND",
        "owner": "aedifex-building-kernel",
        "integration": "@aedifex/nodes builtinPlugin loaded through Plugin API v2",
        "rationale": "The complete native node definition, renderer, tools and schema stay in the pinned authoring kernel."
      },
      {
        "pattern": "cabinet-module",
        "status": "INTEGRATED_NODE_KIND",
        "owner": "aedifex-building-kernel",
        "integration": "@aedifex/nodes builtinPlugin loaded through Plugin API v2",
        "rationale": "The complete native node definition, renderer, tools and schema stay in the pinned authoring kernel."
      },
      {
        "pattern": "item",
        "status": "INTEGRATED_NODE_KIND",
        "owner": "aedifex-building-kernel",
        "integration": "@aedifex/nodes builtinPlugin loaded through Plugin API v2",
        "rationale": "The complete native node definition, renderer, tools and schema stay in the pinned authoring kernel."
      },
      {
        "pattern": "column",
        "status": "INTEGRATED_NODE_KIND",
        "owner": "aedifex-building-kernel",
        "integration": "@aedifex/nodes builtinPlugin loaded through Plugin API v2",
        "rationale": "The complete native node definition, renderer, tools and schema stay in the pinned authoring kernel."
      },
      {
        "pattern": "elevator",
        "status": "INTEGRATED_NODE_KIND",
        "owner": "aedifex-building-kernel",
        "integration": "@aedifex/nodes builtinPlugin loaded through Plugin API v2",
        "rationale": "The complete native node definition, renderer, tools and schema stay in the pinned authoring kernel."
      },
      {
        "pattern": "roof",
        "status": "INTEGRATED_NODE_KIND",
        "owner": "aedifex-building-kernel",